,rating,title,content,useful_count
125,5,手土産に喜ばれます,2セット入ってこのお値段はちょっとしたお相手にピッタリです。とても美味しかったとのお礼を頂きました。,1
126,5,手土産に,お味もしっていたので、安心して購入できました。夫の職場に持参してもらいましたが、みなさんに喜んで頂きよかったです。,0
127,5,贈って喜ばれるお菓子です,安定の美味しさです。,0
128,5,とても良い買い物をさせてもらいました。,プレゼントとして購入させて頂きました。お店のことは知っていたみたいでとても喜んでもらいました。,0
129,5,完璧,手土産様の購入です。最近は包装しての商品が無い中とても有難いです。先様がお留守の分を我が家で頂きました。思っていた以上の和でもあり洋でもある食感、味わいに満足です。購入しても自分で食することが無いのですが、自分が相手先にどの様な手土産品を渡したのか知る事も大切だと思いました。,0
130,5,粉っぽくなくて、ほどよく甘さ控えめのお菓子,買いに行かずに購入できたので有難い。サクッとした生地で中のクリームは甘すぎずとても美味しく食べ応えあります。8枚入りの箱が2箱で包装もちゃんとしたので、父の日に１箱持っていきました☺,2
131,4,サクサク感最高!,王道のサクサク感、類似品もありますが、やっぱりこれって感じです。,2
132,5,美味しい,初めて食べた時から大好きな菓子です。,1
133,5,退職の挨拶,到着が早い！,0
134,5,品質はとても気に入りました,歯触りが良く甘さ控えめが良かった,0
135,5,美味いお菓子です。,京都に行かなくても購入する事が出来ました。美味しいお菓子ですね。,0
136,5,とてもおいしいです。,やめれれないくらい嚙み心地や味とてもおいしいです。なくなるとついつい買ってしまいます。,0
